{
  "adapters": [],
  "case_id": "case_bench_fmu-001535",
  "connections": [],
  "execution_order": [
    "asset_bench_fmu-001535"
  ],
  "external_inputs": [],
  "loop_resolution": [],
  "monitored_outputs": [
    {
      "name": "counter",
      "source": "asset_bench_fmu-001535.counter"
    }
  ],
  "notes": [
    "Auto-generated single-FMU benchmark solution."
  ],
  "schedule": {
    "kind": "single_fmu",
    "start_time": 0,
    "step_size": 0,
    "stop_time": 10
  },
  "schema": "UNIFIED_SOLUTION_V1",
  "selected_asset_ids": [
    "asset_bench_fmu-001535"
  ]
}
