{
  "adapters": [],
  "case_id": "case_bench_fmu-002558",
  "connections": [],
  "execution_order": [
    "asset_bench_fmu-002558"
  ],
  "external_inputs": [],
  "loop_resolution": [],
  "monitored_outputs": [
    {
      "name": "x0",
      "source": "asset_bench_fmu-002558.x0"
    },
    {
      "name": "x1",
      "source": "asset_bench_fmu-002558.x1"
    }
  ],
  "notes": [
    "Auto-generated single-FMU benchmark solution."
  ],
  "schedule": {
    "kind": "single_fmu",
    "start_time": 0,
    "step_size": 0,
    "stop_time": 20
  },
  "schema": "UNIFIED_SOLUTION_V1",
  "selected_asset_ids": [
    "asset_bench_fmu-002558"
  ]
}
